Q,A
未成年能办信用卡吗, 未成年人不能申请信用卡主卡，只有满足16周岁以上的，可以让家人帮助办理信用卡附属卡使用。申请副卡是和主卡挂钩的，在申请主卡的时候楼主只需要在提交申请表的时候勾选 是否申请副卡 这一栏，如果打算申请副卡，那么在填写申请表的时候就统一将申请表填好，这样主卡和副卡就会同时寄到。然后就可以使用副卡了，另外副卡的额度是和主卡的额度挂钩的。
未成年可以办什么信用卡,"未成年人年龄在18周岁以下，不具备还款能力，银行给他们发信用卡是有很大的风险的，所以银监会规定未成年人不可以办信用卡，但是能由直系亲属为其办理一种附属卡。
虽说未成年人能够通过办理附属卡的方式来拥有一张信用卡，但是申请这种信用卡也是需要满足一定的条件的，具体如下：
①年龄方面：不同银行的规定并不相同，一些银行的规定为年满13周岁，一部分银行要求需年满16周岁，也有一些银行的年龄限制为18周岁。
②关系方面：大多数银行规定附属卡申请人必须为主卡持卡人直系亲属，包括父母. 配偶以及子女，就可以由主卡申请人为其办理。"
未成年为什么不能办信用卡,据了解，目前大多数银行都开通了信用卡业务，虽说各行信用卡的申请门槛有高有低，但是一般申请人都必须具备三个条件，一个是年龄必须在18~65周岁之间，一个是要有稳定的工作，具备一定的还款能力，还有一个就是要信用良好。
